{
  "kind": "planning-execplan/v1",
  "title": "Product Compression Closure Review 2026 04 26",
  "goal": [
    "Complete #375 by reassessing whether #230 is honestly satisfied after the product-compression slices landed."
  ],
  "non_goals": [
    "Implement more compression during the closure review.",
    "Keep #230 open as a generic improvement bucket without concrete remaining work."
  ],
  "machine_readable_contract": {
    "intent": {
      "outcome": "Record the #230 closure decision with evidence and close #375/#230 if the intent is satisfied.",
      "constraints": "Do not close #230 without concrete evidence that visible product shape is smaller and remaining surfaces earn their cost.",
      "latitude": "Bounded decomposition, touched-path narrowing, validation tightening, and plan-local residue routing.",
      "escalation": "Escalate when a better-looking fix changes the requested outcome, owned surface, time horizon, or meaningful validation story."
    },
    "execution": {
      "milestone": "product-compression-closure-review-2026-04-26",
      "status": "completed",
      "next_step": "Archive the closure review plan and leave the queue empty.",
      "proof": "Summary, planning check, reconcile, and live issue state confirm no open planned product-compression issues remain."
    },
    "scope": {
      "touched": [
        "Fill in the concrete files before implementation starts."
      ],
      "invariants": [
        "Preserve the planning contract and keep the work bounded to this plan."
      ]
    }
  },
  "intent_continuity": {
    "larger intended outcome": "Complete the bounded work for TODO item `product-compression-closure-review-2026-04-26`.",
    "this slice completes the larger intended outcome": "yes",
    "continuation surface": "none"
  },
  "required_continuation": {
    "required follow-on for the larger intended outcome": "no",
    "owner surface": "none",
    "activation trigger": "none"
  },
  "iterative_follow_through": {
    "what this slice enabled": "none yet",
    "intentionally deferred": "none",
    "discovered implications": "none yet",
    "proof achieved now": "pending",
    "validation still needed": "current milestone validation remains pending",
    "next likely slice": "continue the current milestone until the completion criteria are met"
  },
  "delegated_judgment": {
    "requested outcome": "Complete the bounded work for TODO item `product-compression-closure-review-2026-04-26`.",
    "hard constraints": "Keep scope bounded to the promoted TODO item and its stated touched paths.",
    "agent may decide locally": "Bounded decomposition, touched-path narrowing, validation tightening, and plan-local residue routing.",
    "escalate when": "A better-looking fix changes the requested outcome, owned surface, time horizon, or meaningful validation story."
  },
  "system_intent_alignment": {
    "relevant system intent": "Preserve the larger intended outcome separately from this bounded slice.",
    "slice shaping bias": "Keep the slice bounded while carrying any larger follow-on through explicit continuation fields.",
    "broader-lane validation question": "Did this slice advance the declared larger outcome, or only complete the local task?",
    "intent evidence source": ".agentic-workspace/docs/system-intent-contract.md"
  },
  "references": [],
  "active_milestone": {
    "id": "product-compression-closure-review-2026-04-26",
    "status": "completed",
    "scope": "#375 and #230",
    "ready": "ready",
    "blocked": "none",
    "optional_deps": "none"
  },
  "immediate_next_action": [
    "Fill the execution contract and begin the first bounded implementation step."
  ],
  "blockers": [
    "None."
  ],
  "touched_paths": [
    ".agentic-workspace/planning/reviews/product-compression-closure-review-2026-04-26.review.json",
    ".agentic-workspace/planning/state.toml",
    ".agentic-workspace/planning/external-intent-evidence.json"
  ],
  "invariants": [
    "Preserve the planning contract and keep the work bounded to this plan."
  ],
  "validation_commands": [
    "uv run agentic-workspace summary --format json",
    "uv run python scripts/check/check_planning_surfaces.py",
    "uv run agentic-workspace reconcile --format json",
    "gh issue list --state open --limit 10 --json number,title"
  ],
  "required_tools": [
    "None."
  ],
  "completion_criteria": [
    "#375 is implemented and closed.",
    "#230 is either closed with evidence or kept open with a smaller child lane.",
    "The review lists concrete compressed/merged/backgrounded surfaces and remaining surface justification."
  ],
  "execution_summary": {
    "outcome delivered": "#375 concluded #230 is satisfied enough to close. The review records concrete evidence from #371-#374 and states that future compression should be opened as narrower issues with fresh evidence.",
    "validation confirmed": "uv run agentic-workspace summary --format json; uv run python scripts/check/check_planning_surfaces.py; uv run agentic-workspace reconcile --format json; gh issue list --state open --limit 10 --json number,title.",
    "follow-on routed to": "none",
    "post-work posterity capture": ".agentic-workspace/planning/reviews/product-compression-closure-review-2026-04-26.review.json",
    "knowledge promoted (Memory/Docs/Config)": "none",
    "resume from": "no active product-compression lane"
  },
  "proof_report": {
    "validation proof": "Closure review recorded and live issues #375 and #230 were closed.",
    "proof achieved now": "yes",
    "evidence for \"proof achieved\" state": "Review artifact classifies #375 and #230 as evidence_present/closed; gh issue close succeeded for both; planning checks and reconcile are run after archive."
  },
  "intent_satisfaction": {
    "original intent": "Complete the bounded work for TODO item `product-compression-closure-review-2026-04-26`.",
    "was original intent fully satisfied?": "yes",
    "evidence of intent satisfaction": "#375 closure review concluded #230 is satisfied after #371-#374 reduced first-contact adapter duplication, generated-adapter drift risk, manual review-record authoring, and lifecycle dry-run scan burden.",
    "unsolved intent passed to": "none"
  },
  "closure_check": {
    "slice status": "completed",
    "larger-intent status": "closed",
    "closure decision": "archive-and-close",
    "why this decision is honest": "No concrete product-compression child lane remains; future compression should be opened as narrower issues with fresh evidence.",
    "evidence carried forward": ".agentic-workspace/planning/reviews/product-compression-closure-review-2026-04-26.review.json",
    "reopen trigger": "Open a new narrower issue if fresh visible product residue appears; do not reopen #230 as a generic bucket."
  },
  "closeout_distillation": {
    "buckets": {
      "discard": [
        {
          "summary": "No Memory, docs, or config promotion was needed for local execution detail.",
          "owner": "discard",
          "source": "execution_summary.knowledge promoted (Memory/Docs/Config)"
        }
      ],
      "continuation": [],
      "memory": [],
      "config_check": [],
      "docs": [],
      "issue_follow_up": []
    }
  },
  "drift_log": [
    "2026-04-26: Promoted from TODO direct-task shape into an execplan."
  ]
}
