{
  "kind": "planning-execplan/v1",
  "id": "repo-evidence-measurements",
  "title": "Add measurable repo evidence",
  "owner_level": "slice",
  "lifecycle": "live",
  "phase": "closeout",
  "revision": 3,
  "intent": {
    "outcome": "Create a bounded plan for Add measurable repo evidence.",
    "non_goals": [
      "Leave adjacent backlog or follow-on work out of this plan."
    ]
  },
  "parent": {
    "owner_id": "none",
    "contribution": "Create a bounded plan for Add measurable repo evidence.",
    "closure_boundary": "this slice only"
  },
  "scope": {
    "owned": [
      "Fill in the concrete files before implementation starts."
    ],
    "effects": []
  },
  "relationships": {
    "selection": {
      "state": "selected-local",
      "owner": "repo-evidence-measurements"
    },
    "proof_posture": {
      "state": "accepted",
      "refs": [
        ".agentic-workspace/local/proof-receipts/last.json"
      ]
    },
    "external_posture": {
      "state": "unobserved",
      "refs": []
    },
    "integration": {
      "status": "feature-complete-integration-pending",
      "proposal_id": "repo-evidence-measurements-archive-owner",
      "proposal_ref": ".agentic-workspace/planning/integration-proposals/repo-evidence-measurements-archive-owner.integration-proposal.json",
      "requested_transition": "archive-owner",
      "proof_refs": [
        ".agentic-workspace/local/proof-receipts/last.json"
      ],
      "authority": "feature-head declaration; target integration remains terminal authority"
    }
  },
  "references": [],
  "next_action": "Apply integration proposal 'repo-evidence-measurements-archive-owner' from admitted target authority.",
  "blockers": [
    "None."
  ],
  "proof": {
    "claims": [
      "Add measurable repo evidence is implemented, validated, and closed out honestly."
    ],
    "requirements": [
      "Fill in the narrowest command that proves the promoted work."
    ],
    "refs": [
      ".agentic-workspace/local/proof-receipts/last.json"
    ]
  },
  "continuation": {
    "owner": "none",
    "residual_intent": "none"
  },
  "specialist_contracts": [],
  "goal": [
    "Resolve #2907 by extending current-evidence requirements with typed measurable evidence: metric, unit, comparator, threshold, aggregation, sample count, subject/environment/source revision, state, and detail route; support absolute, relative/scaling, and deterministic-count evidence through the existing operating decision."
  ],
  "non_goals": [
    "Do not build a benchmark framework, execute measurements inside the decision compiler, seed the full #2909 policy set, fix #2564, close #2817, or modify research epic #2821-#2827."
  ],
  "intent_continuity": {
    "larger intended outcome": "Resolve #2906-#2909 and #2564 as a consolidated stacked PR series while preserving the separate #2821-#2827 research epic and the authorization boundary on #2817.",
    "this slice completes the larger intended outcome": "no",
    "continuation surface": ".agentic-workspace/planning/lanes/repo-evidence-requirements.lane.json"
  },
  "execution_bounds": {
    "allowed paths": "src/agentic_workspace/**; tests/**; docs/**; .agentic-workspace/planning/**",
    "max changed files": "20",
    "required validation commands": "Focused config, instruction-clause, operating-decision, schema/reference, lint, typecheck, and repository-selected proof.",
    "ask-before-refactor threshold": "Stop if measurement support requires a new command family, benchmark runner, peer policy engine, or generalized expression language.",
    "stop before touching": "Research epic #2821-#2827; structured-executor runtime; non-local delegation without explicit user authorization; unrelated user changes."
  },
  "touched_paths": [
    "src/agentic_workspace/config.py",
    "src/agentic_workspace/workspace_runtime_core.py",
    "src/agentic_workspace/instruction_clause_ir.py",
    "src/agentic_workspace/operating_decision.py",
    "src/agentic_workspace/contracts/**",
    "tests/test_instruction_clause_ir.py",
    "tests/test_workspace_config_cli.py",
    "docs/maintainer/repo-evidence-requirements.md",
    "docs/reference/workspace-config.md",
    ".agentic-workspace/planning/**"
  ],
  "validation_commands": [
    "uv run --active pytest tests/test_instruction_clause_ir.py tests/test_workspace_config_cli.py -q",
    "make lint-workspace",
    "make typecheck",
    "make schema-reference-docs",
    "make maintainer-surfaces",
    "uv run --frozen --active --no-sync python scripts/run_agentic_workspace.py proof --target . --changed <paths> --format json"
  ],
  "completion_criteria": [
    "Measurement evidence preserves metric, unit, comparator, threshold, aggregation, sample count, subject, environment, source revision, state, and exact detail route.",
    "Absolute, relative/scaling, and deterministic-count fixtures compile through the existing current-evidence capability and operating decision.",
    "Failed, stale, unknown, unavailable, and invalid measurement states remain distinguishable and block only the relevant current-evidence claim.",
    "Currentness and reuse are bound to subject/environment/source revision so changed inputs invalidate prior evidence.",
    "Schema/reference docs and focused tests pass without changes to #2821-#2827."
  ],
  "proof_report": {
    "validation proof": ".agentic-workspace/local/proof-receipts/last.json",
    "proof achieved now": "yes; integration-propose recorded accepted feature-head proof.",
    "evidence for \"proof achieved\" state": ".agentic-workspace/local/proof-receipts/last.json"
  },
  "execution_run": {
    "run status": "completed",
    "executor": "current planning owner",
    "handoff source": "repo-evidence-measurements",
    "what happened": "Create a bounded plan for Add measurable repo evidence.",
    "scope touched": "Fill in the concrete files before implementation starts.",
    "changed surfaces": "Fill in the concrete files before implementation starts.",
    "validations run": ".agentic-workspace/local/proof-receipts/last.json",
    "result for continuation": "feature-head complete; terminal lifecycle remains target-authoritative",
    "next step": "Apply integration proposal 'repo-evidence-measurements-archive-owner' from admitted target authority."
  },
  "finished_run_review": {
    "review status": "complete",
    "scope respected": "yes; bounded feature-head scope and proof were reviewed.",
    "proof status": "passed",
    "intent served": "yes; target integration remains the terminal lifecycle authority.",
    "config compliance": "used planning integration-propose command-owned writer",
    "misinterpretation risk": "low",
    "follow-on decision": ".agentic-workspace/planning/integration-proposals/repo-evidence-measurements-archive-owner.integration-proposal.json"
  },
  "intent_satisfaction": {
    "original intent": "Create a bounded plan for Add measurable repo evidence.",
    "was original intent fully satisfied?": "yes",
    "evidence of intent satisfaction": ".agentic-workspace/local/proof-receipts/last.json",
    "unsolved intent passed to": "none"
  },
  "closure_check": {
    "closeout scope": "slice",
    "slice status": "completed",
    "larger-intent status": "closed",
    "closure decision": "archive-and-close",
    "why this decision is honest": "Feature-head proof is accepted; terminal lifecycle truth awaits target integration.",
    "evidence carried forward": ".agentic-workspace/local/proof-receipts/last.json",
    "reopen trigger": "New contradictory evidence or rejected target integration."
  }
}
